,id,viewCount,likeCount,dislikeCount,commentCount,publishedAt,title,channelTitle
0,hZtQiHodSD4,2868,6,1,,2010-03-01T18:56:09.000Z,Wizarding World of Harry Potter Park Flying Tour,Destinations in Florida
1,kCUqAq0dYgI,3404,3,0,,2010-03-02T15:55:41.000Z,Wizarding World of Harry Potter Theme Park Places,Destinations in Florida
2,Jwc_jktlngI,5507,84,1,17,2010-03-04T18:24:39.000Z,Cowboy Casanova - Harry Potter Style,tangerineextreme
3,4oN42CqEXek,35738,129,14,55,2010-03-04T21:56:11.000Z,Harry Potter Character themesongs (Disney) Part 1/2,JessicaxAlba
4,7jCKo1s_EEY,50258,184,5,49,2010-03-05T10:09:52.000Z,Deathly Hallows photoshoot of our heros in Harry Potter,puppetpals3
5,UYpW3aYOnm4,1738,3,1,4,2010-03-08T00:39:59.000Z,Harry Potter And The Goblet Of Fire - Moody&#39;s Challenges Tower Blocks,Oddleif65
6,a4iq3qoM-k4,32361,116,6,26,2010-03-08T02:17:55.000Z,Lego Harry Potter,Swanky Films
7,yovkk2f0PFc,25071,272,5,42,2010-03-09T21:20:37.000Z,I&#39;ll be there for you - Harry Potter Tribute,SanaeShiho
8,6ARvUB1am-s,60686,701,19,40,2010-03-10T14:49:42.000Z,Sigla - I Maghi Di Hogwarts (Harry Potter meets Wizards of Waverly Place),ShidoLionheart2
9,BW1fQ6NgMUk,824618,6420,756,1671,2010-03-10T20:20:37.000Z,The Duel of Champions,NavajoJoeFilms
10,0XQN1toU2jE,2717,30,1,6,2010-03-11T06:22:08.000Z,welcome to my life -harry potter,MsAdorableIdiot
11,76YuAPW2-q4,33910,293,18,,2010-03-11T07:15:06.000Z,harry potter the way it should have been part 3,MsAdorableIdiot
12,egzzycFpTeQ,98844,239,16,17,2010-03-11T12:49:23.000Z,Live fra Bremen: Brian Mikkelsen som Harry Potter,TV 2 Danmark
13,4KhB0tCp8AA,57386,212,8,37,2010-03-12T03:21:37.000Z,Harry Potter and the Deathly Hallows - Horcruxes/The Silver Doe [BOIT],SilverShadow0111
14,OvToePSPpZI,10356,19,27,24,2010-03-12T15:05:37.000Z,Weiblicher &quot;Harry Potter&quot; sorgt für Furore,AFP Deutschland
15,-5tj-ympfek,56200,1556,24,51,2010-03-12T17:47:20.000Z,Potter Puppet Pals - Mysterious ticking noise,Kathazar
16,GLpPE_Dh_oM,11233,128,1,0,2010-03-15T17:51:52.000Z,Hogwarts People Take It Off [Harry Potter &amp; Ke$ha],GuiltyyDreamer
17,W_VQEzbPKiE,11545,137,2,18,2010-03-16T02:58:13.000Z,Harry Potter - You Raise Me Up,RavenclawGirl29
18,M2IEcreewrs,46584,52,4,18,2010-03-16T17:49:29.000Z,Harry Potter i Więzień Azkabanu - Ostatni dzień w Hogwarcie [1/5] (part 21),FlyStudios
19,op095vRv1F4,343581,1934,55,104,2010-03-17T01:59:48.000Z,TiK ToK- Harry Potter Style,limeonade25
20,lPfXboaENgY,20241,70,6,18,2010-03-18T03:49:01.000Z,Harry Potter And The Goblet Of Fire - Forbidden Forrest Fifth Triwizard Shield,Oddleif65
21,a6PEamjmjBU,137965,474,11,51,2010-03-18T22:53:38.000Z,Sneak peek at Harry Potter and the Forbidden Journey ride at Universal Orlando,Attractions Magazine
22,qMt9sx7HC58,20953,67,1,29,2010-03-18T23:12:47.000Z,March 2010 update for Wizarding World of Harry Potter construction,Attractions Magazine
23,T_tz5OE2qas,61829,229,2,28,2010-03-19T00:21:31.000Z,First Look at the Harry Potter and the Forbidden Journey ride at Universal Orlando,Inside the Magic
24,CMh451OHzCw,40721,607,11,36,2010-03-19T10:01:07.000Z,HUMOR MAYORCETE - HARRY POTTER,mayorcete
25,_eP2_p6Hv2Y,25305,43,1,40,2010-03-20T03:51:41.000Z,"Wizarding World of Harry Potter - March 19th, 2010",MookieMovies
26,Sy792J873CA,42698,273,11,28,2010-03-20T11:31:08.000Z,Ron &amp; Harry (Harry Potter meets Tom &amp; Jerry),ShidoLionheart2
27,CuF3F_xnLic,10836,111,10,6,2010-03-20T15:53:38.000Z,Harry Potter In The Middle Opening (Harry Potter meets Malcolm in the middle),ShidoLionheart2
28,E-y0nF-6J3c,170673,1202,44,83,2010-03-20T16:00:47.000Z,iPotter (iCarly meets Harry Potter),ShidoLionheart2
29,IcDOiUS99zk,60408,344,5,39,2010-03-20T21:12:57.000Z,Harry Potter 2 - Le club de duel,geekdan97
30,BqmrXbDZEXw,6353,13,1,7,2010-03-21T06:14:26.000Z,Pixlr Tutorial Collage (Harry Potter) Part 2/2,d3eusebio
31,BPEOjUnPuZA,56797,718,9,32,2010-03-23T09:57:05.000Z,Stay with Me || Sirius Black and Harry Potter,IcyParadise1
32,ur5cH7NEcbo,471,4,0,0,2010-03-23T20:34:12.000Z,Calling all Harry Potter fans,WLFITV
33,s8zBR1l4Tgc,108262,351,12,27,2010-03-24T16:54:20.000Z,Harry Potter Book Trailer,Scholastic
34,mi2CNz2gKGw,48455,66,2,20,2010-03-25T05:15:58.000Z,Tour Hogsmeade Village in the Wizarding World of Harry Potter,Inside the Magic
35,3EmusCXB5lE,5004,16,0,,2010-03-25T20:59:44.000Z,Harry Potter and The Forbidden Journey Ride,Destinations in Florida
36,HxqqPS0D1xI,56763,32,4,13,2010-03-26T16:32:04.000Z,LEGO Harry Potter: Years 1-4 - Trailer - PS3/Xbox360,PlayscopeTrailers
37,gHwXSyGf4tQ,211033,671,18,117,2010-03-27T05:57:04.000Z,Harry Potter - Hedwig&#39;s Theme,AIainPierre
38,WqtMjnkW7TA,12886,6,0,1,2010-03-27T14:27:01.000Z,LEGO Harry Potter - Year Three Trailer | HD,XboxViewTV
39,NhPeoqE__JU,16820,18,2,4,2010-03-27T15:19:52.000Z,LEGO Harry Potter - Opening Cinematic | HD,XboxViewTV
40,ASeO6RJToJc,32090,126,9,22,2010-03-28T15:58:24.000Z,Harry Potter and the Chamber of Secrets pc - Spongify Challenge secrets,HaldonarOfGondor
41,SHlK0EUyO2c,6289,144,2,24,2010-03-28T21:07:33.000Z,Harry Potter - Crying Lightning,centperk
42,8I3CZgvH8m8,3891,43,3,16,2010-03-29T13:14:20.000Z,It Sucks to be Me- Harry Potter,Kopple36
43,EO-q2ToMGGA,8037,79,4,18,2010-03-29T16:11:51.000Z,VICTOR UGARTE la VOz de SASUKE y HARRY POTTER te Invita CCP,MAGO REY
44,4tj0eHgfeC8,5717,15,2,6,2010-03-29T18:29:54.000Z,Harry Potter III WA 1 - Początek,Ivenius12
45,Sq4OkJnrte8,37725,32,5,9,2010-03-30T00:03:41.000Z,LEGO Harry Potter: Years 1-4 &quot;Year Three&quot; Trailer,G4VideogameTrailers
46,DPJOal4rGbc,12984,391,10,211,2010-03-30T05:10:31.000Z,My Beef with the Harry Potter Movies,WhatTravisSays
47,_2Y-gzyWaC4,2760,19,0,7,2010-03-30T17:42:01.000Z,Harry Potter//Hermione Granger- One Step at a Time,Bea Cunha
48,jWMUroX_7H8,92999,341,25,32,2010-03-31T18:26:34.000Z,Harry Potter - Expelliarmus,Rodrigo Santana
49,ATe8lamuBjk,50617,63,9,11,2010-03-31T22:17:37.000Z,Preview: Ellen DeGeneres at the Wizarding World of Harry Potter,Inside the Magic
