,id,viewCount,likeCount,dislikeCount,commentCount,publishedAt,title,channelTitle,publishTime
0,_JVXQSsR-1Y,175884,945,34,142,2011-04-01T04:40:17Z,Harry Potter Film Intros,IANVARIVS PHILIPPVS,2011-04-01T04:40:17Z
1,2WhhS2maFEs,836216,6631,533,2160,2011-04-01T07:01:05Z,Harry Potter TV Show: The Aurors - Official Trailer,IGN,2011-04-01T07:01:05Z
2,3rvFReRxSaA,87943,426,14,107,2011-04-02T05:04:42Z,Deathly Hallows - Part 1: &quot;Death Eaters Take Over&quot; Clip [HD],Tony T,2011-04-02T05:04:42Z
3,-EqRy3Hl6Mk,176553,599,15,60,2011-04-02T12:45:23Z,Le conte des trois frère - Harry Potter et les reliques de la mort (partie 1),Lyrics350,2011-04-02T12:45:23Z
4,TOz8NAvqdNM,95229,1364,19,132,2011-04-02T18:36:24Z,Harry Potter y las reliquias de la muerte parte I escena eliminada despedida con Dudley,SongsLyricsMore,2011-04-02T18:36:24Z
5,V9DGXTDZMp8,175225,1678,17,280,2011-04-02T20:46:05Z,Harry Potter and the Deathly Hallows - Part 1: Deleted Scenes,Tony T,2011-04-02T20:46:05Z
6,9gJO3RcVDgA,81337,702,46,30,2011-04-05T17:53:13Z,Обзор Harry Potter Mod,DRAKULA,2011-04-05T17:53:13Z
7,ch8uPA7-hPE,47587,229,8,42,2011-04-07T07:38:00Z,Harry potter camping tent!!,leo41224,2011-04-07T07:38:00Z
8,5PZhWhecqVY,644061,4482,32,327,2011-04-08T10:49:40Z,Harry Potter Cast Having Fun On The Set,Loren Solas,2011-04-08T10:49:40Z
9,ntz_32_7LTk,493983,4340,64,260,2011-04-10T09:49:39Z,Harry Potter y las Reliquias de la Muerte: Todas las escenas eliminadas,ZorexChannel93,2011-04-10T09:49:39Z
10,upBtsHUf4Y8,620112,2087,145,123,2011-04-11T03:45:39Z,EL BANANERO - HARRY POTTER,Sergio Delgado,2011-04-11T03:45:39Z
11,ec4QyD6xJDM,55566,560,24,158,2011-04-11T17:18:30Z,Harry Potter and the Goblet of Fire Censored,ThisWouldBeMike,2011-04-11T17:18:30Z
12,OrmOTnztIYg,90444,704,5,102,2011-04-12T12:15:09Z,Robbie Coltrane And Michael Gambon On Harry Potter And The Deathly Hallows: Part One,Empire Magazine,2011-04-12T12:15:09Z
13,1iqv5XTUQ98,123220,1506,4,197,2011-04-12T12:17:08Z,David Thewlis And Natalia Tena Talk Harry Potter And The Deathly Hallows: Part One | Empire Magazine,Empire Magazine,2011-04-12T12:17:08Z
14,twHLFlqZ8T8,2885643,14657,523,3269,2011-04-12T20:39:13Z,Hermione being Tortured by Bellatrix in Harry Potter and the Deathly Hallows Part 1 (HD),tzekoulis,2011-04-12T20:39:13Z
15,RrBLwllJyWo,99561,402,13,163,2011-04-13T17:12:24Z,DELETED SCENE of Harry Potter 7 part 1 - Ron and Harry chasing a rabbit in the forest,adeleblack97,2011-04-13T17:12:24Z
16,3-eNRHWRhLI,65147,476,9,192,2011-04-14T12:11:24Z,Harry Potter And The Deathly Hallows Part 1 Silver Doe Scene,ThePottermovies,2011-04-14T12:11:24Z
17,A4x64x2T6t4,201469,922,16,131,2011-04-14T20:03:46Z,Hagrid and Dumbledore on Harry Potter and Fart Machines!,POPSUGAR Entertainment,2011-04-14T20:03:46Z
18,NuVuVA5BjgY,711347,9158,353,2091,2011-04-15T05:14:00Z,Dumbledore&#39;s Army (Harry Potter Rap),twwpem14,2011-04-15T05:14:00Z
19,VsS1-jhNn2A,574845,3030,83,256,2011-04-15T12:57:04Z,Ginny Weasley and Bill Weasley talk kissing Harry Potter with Brad Blanks,bradblanks,2011-04-15T12:57:04Z
20,RsnPrULuqNQ,151284,1567,7,152,2011-04-15T17:41:46Z,Harry Potter&#39;s Fred and George Weasley on Deathly Hallows Battle Scenes,POPSUGAR Entertainment,2011-04-15T17:41:46Z
21,kXpT4Dod0mI,115858,981,17,43,2011-04-17T14:02:52Z,Harry Potter (and the Chamber of Secrets) - Fawkes the Phoenix (Piano Cover; comp. by John Williams),pianomusiclovr,2011-04-17T14:02:52Z
22,PQq6cpIPhsg,111702,1603,7,93,2011-04-17T18:40:04Z,Gary Oldman - Daniel Radcliffe talks about working with him on Harry Potter,Gary Oldman Web,2011-04-17T18:40:04Z
23,3N2NYVbfBhA,98998,238,4,12,2011-04-19T13:11:03Z,Harry Potter e i Doni della Morte parte 2 - Featurette sottotitolata,Warner Bros. Italia,2011-04-19T13:11:03Z
24,Ksa-2JL23zo,61444,457,2,52,2011-04-19T20:04:09Z,Harry Potter&#39;s Arthur Weasley &amp; Narcissa Malfoy on Wizard Parenting,POPSUGAR Entertainment,2011-04-19T20:04:09Z
25,fBMOvW04Mn8,35970,815,9,,2011-04-19T20:30:15Z,Harry Potter e i doni della morte-Harry e Hermione,PatyMaker🎬,2011-04-19T20:30:15Z
26,9B8JTTqZHBk,126830,938,16,90,2011-04-20T01:17:33Z,Snape to Malfoy Manor - Harry Potter and the Deathly Hallows Part 1 (HD),tzekoulis,2011-04-20T01:17:33Z
27,pEWutsQtKBg,262362,5256,23,168,2011-04-21T15:51:10Z,Harry Potter On the Road // Malfoy Manor,XxlQueenOfHeartslxX,2011-04-21T15:51:10Z
28,lcIGZzwM4lU,137657,577,13,37,2011-04-22T14:11:46Z,Harry Potter et les Reliques de la Mort - Partie 2 - Making Of &quot;Scène finale&quot; (VOST),Warner Bros. France,2011-04-22T14:11:46Z
29,N0syHGJ-9y0,23894,101,0,3,2011-04-22T14:54:13Z,Harry Potter et les Reliques de la Mort -Making Of &quot;Hermione Disparait&quot; (VOST),Warner Bros. France,2011-04-22T14:54:13Z
30,HpXib6WbCKU,95324,501,11,8,2011-04-22T15:06:16Z,Harry Potter et les Reliques de la Mort - Making Of &quot;Harry imite Ron et Hermione&quot; (VOST),Warner Bros. France,2011-04-22T15:06:16Z
31,b8aP1aTTUU8,64220,661,4,15,2011-04-22T16:05:00Z,Harry Potter et les Reliques de la Mort - Interview des acteurs sur la fin de la saga (VOST),Warner Bros. France,2011-04-22T16:05:00Z
32,2CIXXvInAoU,1216714,24282,399,616,2011-04-23T01:28:17Z,Harry Potter y Las reliquias de la muerte El cuento de los tres hermanos,sreafuel,2011-04-23T01:28:17Z
33,VnMAA8RFeeM,950301,9186,184,1660,2011-04-24T13:25:03Z,Harry Potter And The Deathly Hallows Part 2 Intro HD (Fan Made),Jackardy,2011-04-24T13:25:03Z
34,fk7JjNQ5kfE,260881,3080,53,142,2011-04-24T21:39:48Z,Harry Potter - Double Trouble [ ita ],BleedTwiggy,2011-04-24T21:39:48Z
35,voItctzIg-g,185751,2392,9,266,2011-04-26T08:47:58Z,Natalia Tena &amp; David Thewlis talk Harry Potter,Half Blood Mockingjay,2011-04-26T08:47:58Z
36,mObK5XD8udk,12753608,71367,1376,25707,2011-04-27T18:39:35Z,&quot;Harry Potter and the Deathly Hallows - Part 2&quot; Trailer 1,Warner Bros. Pictures,2011-04-27T18:39:35Z
37,cihqiKUTnEs,57226,553,3,28,2011-04-27T19:22:34Z,Harry Potter and the Deathly Hallows Part 2 | Secrets to Flight | Warner Bros. Entertainment,Warner Bros. Entertainment,2011-04-27T19:22:34Z
38,MzL8MM_8zOg,1744066,32450,645,3456,2011-04-27T21:57:39Z,Harry Potter und Zitronenbonbons - das Hörspiel,coldmirror,2011-04-27T21:57:39Z
39,C8ybldvApMY,198126,1073,17,122,2011-04-27T23:56:15Z,&quot;Harry Potter &amp; The Deathly Hallows Part 2&quot; Trailer Music (TRAILER BEAST - &quot;Lords Of The Realm&quot;),Epic Legacy Trailer Music,2011-04-27T23:56:15Z
40,I_kDb-pRCds,9035691,39346,837,14461,2011-04-28T02:50:33Z,Harry Potter and The Deathly Hallows Part 2 Trailer Official (HD),ClevverTV,2011-04-28T02:50:33Z
41,v2EYT0ZazAo,3202832,57401,2441,4694,2011-04-28T04:35:06Z,Harry Potter and The Order of Umbridge by The Hillywood Show®,The Hillywood Show,2011-04-28T04:35:06Z
42,AX85BTPv9KY,94715,396,19,280,2011-04-28T17:38:52Z,Harry Potter and the Deathly Hallows - Part 2 Trailer,Warner Bros. UK,2011-04-28T17:38:52Z
43,cziftfzLD0Q,351605,1573,77,285,2011-04-28T20:30:38Z,"25,000 Dominoes - Harry Potter! TPT 2011",midobo,2011-04-28T20:30:38Z
44,JVHOtfeSf2s,135098,625,23,72,2011-04-29T08:46:08Z,HARRY POTTER 7 - TEIL 2 / offizieller Trailer #1 deutsch HD,Warner Bros. DE,2011-04-29T08:46:08Z
45,9DIt7xV6p28,1647739,5521,143,1657,2011-04-29T10:37:51Z,HARRY POTTER UND DIE HEILIGTÜMER DES TODES (TEIL 2) | Trailer deutsch german [HD],vipmagazin,2011-04-29T10:37:51Z
46,HguSMW8XveQ,245534,1747,33,125,2011-04-29T11:09:58Z,Harry Potter y Las Reliquias de la Muerte Parte 2 Tráiler Oficial HD,Warner Bros. Pictures España,2011-04-29T11:09:58Z
47,wpbhSFJwL0o,493152,3946,72,397,2011-04-29T12:47:14Z,Harry Potter e i Doni Della Morte - Parte 2  - Primo Trailer italiano in HD,Warner Bros. Italia,2011-04-29T12:47:14Z
48,cbGgtCH_qSE,401424,3279,51,539,2011-04-29T17:57:37Z,Harry Potter And The Deathly Hallows: Part 1 DVD Extras - Deleted Scenes,Gianmarkus96,2011-04-29T17:57:37Z
49,1AfFyUZK1So,164860,632,13,37,2011-04-29T22:02:52Z,Harry Potter et Les Reliques de la Mort - Partie 2 - Bande Annonce Officielle (VF),Warner Bros. France,2011-04-29T22:02:52Z
